{
  "type": "action_request", "protocol_version": 1,
  "request_id": "req-combat-1", "world_id": "world-fixture-1",
  "expected_revision": 12, "investigator_id": "inv-alice",
  "action": {"kind": "combat", "encounter_id": "encounter-1", "action_type": "firearm", "target_id": "guard", "weapon_item_id": "item-alice-gun", "approach": "掩护同伴"}
}
