{
  "type": "action_request",
  "protocol_version": 1,
  "request_id": "req-present-unresolved",
  "world_id": "world-fixture-1",
  "expected_revision": 12,
  "investigator_id": "inv-alice",
  "action": {
    "kind": "present_clue",
    "clue_id": "clue_burned_letters",
    "presentation": "describe",
    "physical_item_id": null,
    "target": {
      "kind": "unresolved",
      "text": "殡仪馆里那个不肯报名字的值班员"
    }
  }
}
