{
  "type": "action_request",
  "protocol_version": 1,
  "request_id": "req-present-image",
  "world_id": "world-fixture-1",
  "expected_revision": 12,
  "investigator_id": "inv-alice",
  "action": {
    "kind": "present_clue",
    "clue_id": "clue_death_certificate",
    "presentation": "image",
    "physical_item_id": null,
    "target": {
      "kind": "npc",
      "id": "john_whitcroft"
    }
  }
}
